<?xml version="1.0" encoding="ISO-8859-1"?>
<?oxygen SCHSchema="../resources/schema/bot-configuration.xsd"?>
<bots xmlns="http://aitools.org/programd/4.5/bot-configuration"
    xmlns:xsi="http://www.w3.org/2001/XMLSchema-instance"
    xsi:schemaLocation="http://aitools.org/programd/4.5/bot-configuration http://aitools.org/programd/4.5/bot-configuration.xsd">
    <bot id="yourbot" enabled="true">
        <properties href="properties.xml"/>
        <predicates href="predicates.xml"/>
        <substitutions href="substitutions.xml"/>
        <sentence-splitters href="sentence-splitters.xml"/>
        <listeners href="listeners.xml"/>
        <!-- <learn>../../rebecca/aiml/annotated_alice/*.aiml</learn> -->
        <learn>../../rebecca/aiml/basic_aiml/*.aiml</learn>
    </bot>
</bots>
